{
    "$schema": "http://json-schema.org/draft-07/schema#",

    "title": "Basic Passport for a natural person",

    "type": "object",
    "properties": {
        "@context": {
            "type": "array",
            "items": {
                "type": "string"
            }
        },
        "credentialSchema": {
            "type": "object",
            "properties": {
                "id": {
                    "type": "string"
                },
                "type": {
                    "type": "string"
                }
            },
            "additionalProperties": false
        },
        "credentialStatus": {
            "type": "object",
            "properties": {
                "id": {
                    "type": "string"
                },
                "type": {
                    "type": "string"
                }
            },
            "additionalProperties": false
        },
        "credentialSubject": { "$ref": "#/definitions/BirthCertificate" },
        "evidence": {
            "type": "array",
            "items": {
                "type": "object",
                "properties": {
                    "documentPresence": {
                        "type": "array",
                        "items": {
                            "type": "string"
                        }
                    },
                    "evidenceDocument": {
                        "type": "array",
                        "items": {
                            "type": "string"
                        }
                    },
                    "id": {
                        "type": "string"
                    },
                    "subjectPresence": {
                        "type": "string"
                    },
                    "type": {
                        "type": "array",
                        "items": {
                            "type": "string"
                        }
                    },
                    "verifier": {
                        "type": "string"
                    }
                },
                "additionalProperties": false
            }
        },
        "expirationDate": {
            "type": "string"
        },
        "id": {
            "type": "string"
        },
        "issuanceDate": {
            "type": "string"
        },
        "issued": {
            "type": "string"
        },
        "issuer": {
            "type": "string"
        },
        "proof": {
            "type": "object",
            "properties": {
                "created": {
                    "type": "string"
                },
                "creator": {
                    "type": "string"
                },
                "domain": {
                    "type": "string"
                },
                "jws": {
                    "type": "string"
                },
                "nonce": {
                    "type": "string"
                },
                "proofPurpose": {
                    "type": "string"
                },
                "type": {
                    "type": "string"
                },
                "verificationMethod": {
                    "type": "string"
                }
            },
            "additionalProperties": false
        },
        "type": {
            "type": "array",
            "items": {
                "type": "string"
            }
        },
        "validFrom": {
            "type": "string"
        }
    },
    "required": [
        "@context",
        "type"
    ],
    "additionalProperties": false,

    "definitions": {
        "BirthCertificate": {
            "type": "object",
            "additionalProperties": false,
            "properties": {
                "id": {
                    "type": "string"
                },
                "type": {
                    "type": "string"
                },
                "givenName": {
                    "type": "string"
                },
                "familyName": {
                    "type": "string"
                },
                "birthDate": {
                    "type": "string",
                    "format": "date-time"
                },
                "birthPlace": {
                    "$ref": "#/definitions/BirthPlace"
                },
                "citizenship": {
                    "type": "string"
                },
                "parent": {
                    "type": "array",
                    "items": {
                        "$ref": "#/definitions/Parent"
                    }
                }
            },
            "required": [
                "id",
                "birthDate",
                "birthPlace",
                "citizenship",
                "familyName",
                "givenName",
                "parent"
            ],
            "title": "BirthCertificate"
        },
        "BirthPlace": {
            "type": "object",
            "additionalProperties": false,
            "properties": {
                "type": {
                    "type": "string"
                },
                "address": {
                    "$ref": "#/definitions/Address"
                }
            },
            "required": [
                "address",
                "type"
            ],
            "title": "BirthPlace"
        },
        "Address": {
            "type": "object",
            "additionalProperties": false,
            "properties": {
                "type": {
                    "type": "string"
                },
                "addressLocality": {
                    "type": "string"
                },
                "addressRegion": {
                    "type": "string"
                },
                "postalCode": {
                    "type": "string",
                    "format": "integer"
                },
                "streetAddress": {
                    "type": "string"
                }
            },
            "required": [
                "addressLocality",
                "addressRegion",
                "postalCode",
                "streetAddress",
                "type"
            ],
            "title": "Address"
        },
        "Parent": {
            "type": "object",
            "additionalProperties": false,
            "properties": {
                "id": {
                    "type": "string"
                },
                "type": {
                    "type": "string"
                },
                "givenName": {
                    "type": "string"
                },
                "familyName": {
                    "type": "string"
                },
                "maidenName": {
                    "type": "string"
                }
            },
            "required": [
                "id",
                "givenName",
                "familyName"
            ],
            "title": "Parent"
        }
    }
}
