{
  "@context": [
    "https://www.w3.org/2018/credentials/v1"
  ],
  "type": [
    "VerifiableCredential",
    "BirthCertificate"
  ],
  "credentialSchema": {
    "id": "class:/nessus/schema/BirthCertificateSchema-draft-1.json",
    "type": "JsonSchemaValidator2018"
  },
  "id": "urn:uuid:3add94f4-28ec-42a1-8704-4e4aa51006b4",
  "issuer": "did:ebsi:2A9BZ9SUe6BatacSpvs1V5CdjHvLpQ7bEsi2Jb6LdHKnQxaN",
  "issuanceDate": "2021-08-31T00:00:00Z",
  "credentialSubject": {
    "id": "did:example:8vFBbPrhBUyG6DEzVncBZpzBNsmRrbfsQKXQKPLskBCu",
    "type": "Person",
    "givenName": "Anand",
    "familyName": "Hamal",
    "citizenship": "US",
    "birthDate": "2017-10-01T00:00:00Z",
    "birthPlace": {
      "type": "Hospital",
      "address": {
        "type": "US address",
        "addressLocality": "Denver",
        "addressRegion": "CO",
        "postalCode": "80209",
        "streetAddress": "123 Main St."
      }
    },
    "parent": [{
      "id": "did:example:BcRisGnqV4QPb6bRmDCqEjyuubBarS1Y1nhDwxBMTXY4",
      "type": "Person",
      "givenName": "Malathi",
      "familyName": "Hamal",
      "maidenName": "Holla"
    }, {
      "id": "did:example:BgXRjB4RPrrsUVoVNaYNwzfznKsWep7AWrZkiyVcorEN",
      "type": "Person",
      "givenName": "Rajesh",
      "familyName": "Hamal"
    }]
  }
}